Activity Title,Description,Donor Organization,Implementing Organization,Start Date,End Date,Total Budget,Status,Sector,Recipient Country
"Water Supply Improvement Project","Improving access to clean water in rural areas","World Bank","Ministry of Water Resources",2024-01-15,2025-12-31,2500000,implementation,"Water and Sanitation","Myanmar"
"Primary Education Enhancement","Building new schools and training teachers","UNICEF","Ministry of Education",2024-03-01,2026-02-28,1800000,pipeline,"Education","Myanmar"
"Healthcare Infrastructure Development","Upgrading district hospitals and clinics","Asian Development Bank","Ministry of Health",2024-02-01,2025-06-30,3200000,implementation,"Health","Myanmar"
"Agricultural Support Program","Supporting smallholder farmers with tools and training","USAID","Department of Agriculture",2024-04-01,2025-03-31,1500000,pipeline,"Agriculture","Myanmar"
"Women's Economic Empowerment","Microfinance and skills training for women","UN Women","Ministry of Social Welfare",2024-01-01,2024-12-31,800000,implementation,"Gender Equality","Myanmar"